{
  "type": "object",
  "additionalProperties": false,
  "required": [
    "version",
    "license",
    "imported_at",
    "attribution",
    "phases"
  ],
  "properties": {
    "version": {
      "const": "1.3.0"
    },
    "license": {
      "const": "CC-BY-4.0"
    },
    "imported_at": {
      "type": "string",
      "format": "date"
    },
    "attribution": {
      "$ref": "common.schema.json#/$defs/attribution"
    },
    "phases": {
      "type": "array",
      "minItems": 1,
      "items": {
        "type": "object",
        "additionalProperties": false,
        "required": [
          "phase",
          "name",
          "goal",
          "steps"
        ],
        "properties": {
          "phase": {
            "type": "integer",
            "minimum": 0,
            "maximum": 6
          },
          "name": {
            "type": "string",
            "minLength": 1
          },
          "goal": {
            "type": "string",
            "minLength": 1
          },
          "steps": {
            "type": "array",
            "minItems": 1,
            "items": {
              "type": "object",
              "additionalProperties": false,
              "required": [
                "id",
                "text",
                "item_id"
              ],
              "properties": {
                "id": {
                  "type": "string",
                  "pattern": "^[a-z0-9]+(?:-[a-z0-9]+)*$"
                },
                "text": {
                  "type": "string",
                  "minLength": 1
                },
                "item_id": {
                  "type": [
                    "string",
                    "null"
                  ],
                  "pattern": "^[a-z0-9]+(?:-[a-z0-9]+)*$"
                },
                "optional": {
                  "type": "boolean",
                  "default": false
                }
              }
            }
          }
        }
      }
    }
  },
  "$schema": "https://json-schema.org/draft/2020-12/schema",
  "$id": "https://u1-starthere.example/schemas/phases.schema.json"
}
